{
  "screen_id": "edge-cases-01",
  "source": "fixture",
  "page_url": "fixtures/edge-cases.html",
  "viewport": {
    "width": 1280,
    "height": 713,
    "device_pixel_ratio": 1
  },
  "annotator": "authored from the fixture's planted values, independently of the detectors",
  "notes": "Regression screen for unlabelled controls and PII-typed headings/buttons. The headings h1#h-otp and h2#h-aadhaar, the Resend OTP button and the 'card ending 4242' prose are deliberately NOT annotated: they are Tier 3 structure, and a detector that boxes them is over-redacting. The last-four in prose is a known non-detection (no digit-run rule can bound it without context).",
  "annotations": [
    {
      "id": "e1",
      "type": "person_name",
      "tier": 2,
      "modality": "text",
      "bbox": [
        32,
        244.61,
        374,
        285.11
      ],
      "dom_path": "input#unlabeled-name",
      "value_present": true,
      "notes": "No <label>; only the name attribute identifies it."
    },
    {
      "id": "e2",
      "type": "bank_account",
      "tier": 1,
      "modality": "text",
      "bbox": [
        32,
        299.11,
        374,
        339.61
      ],
      "dom_path": "input#unlabeled-acct",
      "value_present": true
    },
    {
      "id": "e3",
      "type": "address",
      "tier": 2,
      "modality": "text",
      "bbox": [
        32,
        353.61,
        374,
        394.11
      ],
      "dom_path": "input#unlabeled-street",
      "value_present": true
    },
    {
      "id": "e4",
      "type": "otp",
      "tier": 1,
      "modality": "text",
      "bbox": [
        32,
        408.11,
        374,
        448.61
      ],
      "dom_path": "input#otp-empty",
      "value_present": false,
      "notes": "Empty but Tier 1; autocomplete=one-time-code is the only signal."
    },
    {
      "id": "e5",
      "type": "cvv",
      "tier": 1,
      "modality": "text",
      "bbox": [
        32,
        462.61,
        374,
        503.11
      ],
      "dom_path": "input#cvv",
      "value_present": true,
      "notes": "Three digits have no surface form; the name attribute is the only signal."
    },
    {
      "id": "e6",
      "type": "email",
      "tier": 2,
      "modality": "text",
      "bbox": [
        173.88,
        208.11,
        368.33,
        228.11
      ],
      "dom_path": "p#contact",
      "value_present": true,
      "notes": "Free, unlabelled prose — no DOM heuristic context, only the pattern matcher catches it. Also the fixture the privacy-firewall demo switch (disable regex:email) targets. Measured as a text range inside p#contact."
    }
  ]
}
